Headline,Categorize
Psychopathic Tendencies Help Some People Succeed in Business,Non-sensationalised
Do We Actually ‘Hear’ Silence?,Non-sensationalised
Forgotten Memories May Remain Intact in the Brain,Non-sensationalised
AI Anxiety’ Is on the Rise - Here’s How to Manage It,Non-sensationalised
Why Do We Forget So Many of Our Dreams?,Non-sensationalised
Brain Waves Synchronize when People Interact,Non-sensationalised
The Heart Can Sway Our Perception of Time,non-sensationalised
Why Kids Are Afraid to Ask for Help,Non-sensationalised
"If AI Becomes Conscious, Here’s How We Can Tell",Non-sensationalised
Brain-Reading Devices Allow Paralyzed People to Talk Using Their Thoughts,Non-sensationalised
Calculating Success: The Surprising Statistics Behind Psychopathic Triumphs in Business,sensationalised 
Neuroscientist Pioneers at Johns Hopkins: Cracking the Enigma of Silent Perception,sensationalised 
Embracing the Void: The Emotional Landscape of Embracing Forgotten Chapters of Our Lives,sensationalised 
Anxiety Alarms: How AI’s Rapid Advancements Are Triggering Immediate Emotional Turmoil,non-sensationalised
Dream Fades: Quantifying the Vanishing Echoes of Our Nightly Adventures,sensationalised 
Synchronized Minds: Quantifying the Intricate Rhythms of Interbrain Harmony,sensationalised 
Cornell’s Time-Bending Discovery: Unraveling the ‘Temporal Wrinkles’ in Human Perception,sensationalised 
Why Voiceless in Learning: How Fear Instantly Stifles,
Conscious Machines: Quantifying the Criteria That Could Proclaim AI’s Arrival at Sentience,sensationalised
Voices from Within: The Emotional Liberation of Paralyzed Individuals Through Mind-Controlled Speech,sensationalised